{
  "$schema": "https://json-schema.org/draft/2020-12/schema",
  "$id": "https://wodansson.github.io/terraform-azurerm-ai-assisted-development/tools/regression/schema/review-case.schema.json",
  "title": "AI Regression Review Case",
  "type": "object",
  "additionalProperties": false,
  "required": [
    "id",
    "title",
    "task",
    "caseStatus",
    "sourceKind",
    "provenance",
    "sanitized",
    "fixture",
    "scope",
    "expectedRules",
    "mustCatch",
    "mustNotFlag",
    "expectedTools",
    "outputChecks"
  ],
  "properties": {
    "id": {
      "type": "string",
      "pattern": "^[a-z0-9][a-z0-9-]+$"
    },
    "title": {
      "type": "string",
      "minLength": 1
    },
    "task": {
      "type": "string",
      "enum": [
        "code-review-local-changes",
        "code-review-committed-changes",
        "code-review-docs",
        "draft-pr-description",
        "docs-writer",
        "resource-implementation",
        "acceptance-testing"
      ]
    },
    "caseStatus": {
      "type": "string",
      "enum": [
        "planned",
        "ready",
        "adjudicated",
        "retired"
      ]
    },
    "sourceKind": {
      "type": "string",
      "enum": [
        "synthetic"
      ]
    },
    "provenance": {
      "type": "object",
      "additionalProperties": false,
      "required": [
        "originKind",
        "originSummary",
        "whyItMattered",
        "genericCondition"
      ],
      "properties": {
        "originKind": {
          "type": "string",
          "enum": [
            "real-pr",
            "local-diff",
            "maintainer-authored",
            "synthetic-design"
          ]
        },
        "originSummary": {
          "type": "string",
          "minLength": 1
        },
        "whyItMattered": {
          "type": "string",
          "minLength": 1
        },
        "genericCondition": {
          "type": "string",
          "minLength": 1
        },
        "notes": {
          "type": "string"
        }
      }
    },
    "sanitized": {
      "type": "boolean"
    },
    "description": {
      "type": "string"
    },
    "fixture": {
      "type": "object",
      "additionalProperties": false,
      "required": [
        "mode"
      ],
      "properties": {
        "mode": {
          "type": "string",
          "enum": [
            "patch",
            "files",
            "none"
          ]
        },
        "path": {
          "type": "string"
        }
      }
    },
    "scope": {
      "type": "object",
      "additionalProperties": false,
      "required": [
        "changedFiles"
      ],
      "properties": {
        "changedFiles": {
          "type": "array",
          "items": {
            "type": "string"
          }
        },
        "notes": {
          "type": "string"
        }
      }
    },
    "expectedRules": {
      "type": "array",
      "items": {
        "type": "string"
      }
    },
    "mustCatch": {
      "type": "array",
      "items": {
        "type": "object",
        "additionalProperties": false,
        "required": [
          "key",
          "severity",
          "description"
        ],
        "properties": {
          "key": {
            "type": "string"
          },
          "severity": {
            "type": "string",
            "enum": [
              "critical",
              "high",
              "medium",
              "low",
              "observation"
            ]
          },
          "file": {
            "type": "string"
          },
          "description": {
            "type": "string"
          }
        }
      }
    },
    "mustNotFlag": {
      "type": "array",
      "items": {
        "type": "object",
        "additionalProperties": false,
        "required": [
          "key",
          "description"
        ],
        "properties": {
          "key": {
            "type": "string"
          },
          "description": {
            "type": "string"
          }
        }
      }
    },
    "expectedTools": {
      "type": "object",
      "additionalProperties": false,
      "properties": {
        "azurermLinter": {
          "type": "string",
          "enum": [
            "run",
            "not-applicable",
            "not-run"
          ]
        }
      }
    },
    "outputChecks": {
      "type": "object",
      "additionalProperties": false,
      "properties": {
        "mustHaveSections": {
          "type": "array",
          "items": {
            "type": "string"
          }
        },
        "mustIncludeMarkers": {
          "type": "array",
          "items": {
            "type": "string"
          }
        },
        "mustNotIncludeMarkers": {
          "type": "array",
          "items": {
            "type": "string"
          }
        }
      }
    },
    "notes": {
      "type": "string"
    }
  }
}
