{
  "id": "skill-acceptance-testing-importstep",
  "title": "Acceptance-testing guidance applies requiresImport and ImportStep expectations consistently",
  "task": "acceptance-testing",
  "caseStatus": "adjudicated",
  "sourceKind": "synthetic",
  "provenance": {
    "originKind": "synthetic-design",
    "originSummary": "Derived from a sanitized real PR or review incident.",
    "whyItMattered": "Use this as the first direct acceptance-testing skill benchmark for lifecycle-coverage guidance.",
    "genericCondition": "Sanitized fixture models a real acceptance-test guidance incident without retaining live PR identity.",
    "notes": ""
  },
  "sanitized": true,
  "description": "A sanitized modeled acceptance-test guidance scenario where the correct output should restore requiresImport coverage, keep ExistsInAzure as the primary basic assertion, and avoid redundant ImportStep assertions.",
  "fixture": {
    "mode": "files",
    "path": "tools/regression/fixtures/skill-acceptance-testing-importstep/README.md"
  },
  "scope": {
    "changedFiles": [
      "internal/services/example/example_resource_test.go"
    ],
    "notes": "Sanitized fixture models a acceptance-testing guidance benchmark."
  },
  "expectedRules": [
    "TEST-PATTERN-004",
    "TEST-PATTERN-*",
    "TEST-WF-*",
    "TEST-RUN-*"
  ],
  "mustCatch": [
    {
      "key": "requiresimport-regression",
      "severity": "high",
      "description": "The guidance should preserve default requiresImport expectations when they apply."
    },
    {
      "key": "weakened-basic-existence-check",
      "severity": "medium",
      "description": "The guidance should restore ExistsInAzure as the primary basic existence check instead of using a weaker substitute."
    }
  ],
  "mustNotFlag": [
    {
      "key": "redundant-importstep-assertions",
      "description": "The guidance should not require redundant assertions already covered by ImportStep unless a case-specific exception exists."
    }
  ],
  "expectedTools": {},
  "outputChecks": {
    "mustIncludeMarkers": [
      "Skill used: acceptance-testing"
    ]
  },
  "notes": "Use this as the first direct acceptance-testing skill benchmark for lifecycle-coverage guidance."
}
