{
  "id": "review-committed-pr-scoped-file-references",
  "title": "Committed review keeps PR-scoped file references out of editor-local URIs",
  "task": "code-review-committed-changes",
  "caseStatus": "adjudicated",
  "sourceKind": "synthetic",
  "provenance": {
    "originKind": "synthetic-design",
    "originSummary": "Synthetic benchmark scenario designed to exercise the rule directly.",
    "whyItMattered": "Use this case to benchmark committed-review emission of file references when authoritative PR scope is known and editor-local link placeholders must stay out of the assistant-emitted markdown review body.",
    "genericCondition": "Synthetic fixture models a PR-scoped committed review where the historical failure mode inside the repo-controlled workflow was emitting file references as `vscode-file://...workbench.html` editor-session links instead of repo-scoped or PR-scoped references.",
    "notes": ""
  },
  "sanitized": true,
  "description": "A sanitized committed-review scenario where authoritative PR scope exists for a large grouped-resource change-set. The correct assistant-emitted markdown review must keep file references repo-scoped or PR-scoped and must not leak editor-local `vscode-file://` or spill-path placeholders into the emitted review body.",
  "fixture": {
    "mode": "files",
    "path": "tools/regression/fixtures/review-committed-pr-scoped-file-references/README.md"
  },
  "scope": {
    "changedFiles": [
      "internal/services/example/example_group_resource.go",
      "internal/services/example/example_group_resource_list.go",
      "website/docs/r/example_group_resource.html.markdown"
    ],
    "notes": "Synthetic fixture models a PR-scoped committed review where the modeled failure mode inside repo-controlled output was emitting file references as `vscode-file://...workbench.html` editor-session links instead of repo-scoped or PR-scoped references."
  },
  "expectedRules": [
    "REVIEW-FILE-004",
    "REVIEW-PRESENT-004E",
    "REVIEW-EVID-*"
  ],
  "mustCatch": [
    {
      "key": "repo-scoped-file-references-preserved",
      "severity": "high",
      "description": "The committed review should emit repo-scoped or PR-scoped file references when authoritative PR scope is available instead of emitting editor-local placeholder links in the assistant-authored markdown body."
    },
    {
      "key": "editor-local-link-leak-blocked",
      "severity": "high",
      "description": "The assistant-emitted committed review body should not contain `vscode-file://`, `workbench.html`, `AppData`, or `workspaceStorage` link material anywhere in the emitted markdown output."
    }
  ],
  "mustNotFlag": [
    {
      "key": "vscode-file-uri-output",
      "description": "The committed review must not emit `vscode-file://` editor-local URIs in file lists, findings, or standards-check bullets of the assistant-authored markdown body."
    },
    {
      "key": "spill-path-output",
      "description": "The committed review must not emit spill-path fragments such as `workbench.html`, `AppData`, or `workspaceStorage` in the assistant-authored markdown review body."
    }
  ],
  "expectedTools": {
    "azurermLinter": "run"
  },
  "outputChecks": {
    "mustHaveSections": [
      "CHANGE SUMMARY",
      "FILES CHANGED",
      "DETAILED TECHNICAL REVIEW",
      "OVERALL ASSESSMENT"
    ],
    "mustIncludeMarkers": [
      "internal/services/example/example_group_resource.go",
      "internal/services/example/example_group_resource_list.go",
      "website/docs/r/example_group_resource.html.markdown",
      "Preflight complete: yes"
    ],
    "mustNotIncludeMarkers": [
      "vscode-file://",
      "workbench.html",
      "AppData",
      "workspaceStorage"
    ]
  },
  "notes": "Use this case to benchmark committed-review assistant-authored markdown when authoritative PR scope is known and editor-local link placeholders must stay out of repo-controlled output."
}
