{
  "id": "review-local-linter-blocking-wait",
  "title": "Local review must treat azurerm-linter as a blocking wait step",
  "task": "code-review-local-changes",
  "caseStatus": "adjudicated",
  "sourceKind": "synthetic",
  "provenance": {
    "originKind": "synthetic-design",
    "originSummary": "Synthetic benchmark scenario designed to exercise the rule directly.",
    "whyItMattered": "Use this adjudicated case to benchmark whether local review actually waits for azurerm-linter to finish instead of resuming the audit or narrating the wait.",
    "genericCondition": "Synthetic local-diff scope focused on the blocking linter wait rule rather than a specific implementation defect.",
    "notes": ""
  },
  "sanitized": true,
  "description": "A local review scenario where `azurerm-linter` takes noticeable time to finish and the reviewer is tempted to resume auditing, narrate the wait, or classify the linter section from partial runtime state. The correct behavior is to treat the linter as a blocking step and emit no user-visible review content until the completed run can be classified.",
  "fixture": {
    "mode": "none"
  },
  "scope": {
    "changedFiles": [
      "internal/services/example/example_resource.go",
      "internal/services/example/example_resource_test.go"
    ],
    "notes": "Synthetic local-diff scope focused on the blocking linter wait rule rather than a specific implementation defect."
  },
  "expectedRules": [
    "REVIEW-LINT-002B",
    "REVIEW-OUT-005",
    "REVIEW-OUT-006"
  ],
  "mustCatch": [
    {
      "key": "linter-blocking-step-local",
      "severity": "high",
      "description": "The local review should treat the in-flight azurerm-linter run as an outstanding blocking step and should not continue the review until that completed run can be classified."
    }
  ],
  "mustNotFlag": [
    {
      "key": "premature-review-continuation-local",
      "description": "The review must not continue broader evidence gathering, findings classification, or draft the final review body while the linter is still running."
    },
    {
      "key": "partial-linter-classification-local",
      "description": "The review must not classify the azurerm-linter section from partial runtime state before the same run has completed."
    }
  ],
  "expectedTools": {
    "azurermLinter": "run"
  },
  "outputChecks": {
    "mustHaveSections": [
      "CHANGE SUMMARY",
      "FILES CHANGED",
      "DETAILED TECHNICAL REVIEW",
      "OVERALL ASSESSMENT"
    ]
  },
  "notes": "Use this adjudicated case to benchmark whether local review actually waits for azurerm-linter to finish instead of resuming the audit or narrating the wait."
}
